title,summary,link,author
Man stabbed former soldier twice after pub row turned violent,"© Lincolnshire Police Joshua MarshallA man stabbed a former soldier twice in a drunken revenge attack in the street following an argument which erupted at a Lincolnshire pub.
Mr Foster, who did not initially realise he had been stabbed, punched Marshall unconscious.
The court heard Marshall had first met Mr Foster and his friends in another pub the week before.
Mr Howes added: ""Then the complainant realised he had been stabbed and that's caught on CCTV.
Mr Howes summarised Mr Foster's victim impact statement by saying: ""He talks about these scars which remind him of the pain.",https://news.google.com/rss/articles/CBMibmh0dHBzOi8vd3d3Lm1zbi5jb20vZW4tZ2IvbmV3cy93b3JsZC9tYW4tc3RhYmJlZC1mb3JtZXItc29sZGllci10d2ljZS1hZnRlci1wdWItcm93LXR1cm5lZC12aW9sZW50L2FyLUFBMTdLTVBv0gEA?oc=5,[]
Combining environmental payments: biodiversity net gain (BNG) and nutrient mitigation,"You should use the biodiversity metric to calculate how many biodiversity units you can generate from your site.
Stacking biodiversity units and nutrient creditsYou can sell biodiversity units and nutrient credits from the same piece of land by stacking them.
You can sell biodiversity units and nutrient credits if it’s clear what the original sales contract or grant payment paid for.
You can sell biodiversity units and nutrient credits from the same land you used to sell carbon credits.
You may be able to sell biodiversity units and nutrient credits with CSR payments.",https://news.google.com/rss/articles/CBMibmh0dHBzOi8vd3d3Lmdvdi51ay9ndWlkYW5jZS9jb21iaW5pbmctZW52aXJvbm1lbnRhbC1wYXltZW50cy1iaW9kaXZlcnNpdHktbmV0LWdhaW4tYm5nLWFuZC1udXRyaWVudC1taXRpZ2F0aW9u0gEA?oc=5,[]
Video shows moment US missile hits Chinese spy balloon,"8-year-old boy proudly shows off the fish he caught.
See the scary moment that followed",https://news.google.com/rss/articles/CBMiYWh0dHBzOi8vd3d3LmNubi5jb20vdmlkZW9zL3dvcmxkLzIwMjMvMDIvMDUvbW9tZW50LWNoaW5hLXNweS1iYWxsb29uLXNob3Qtdm8tYWNvc3RhbnItdnB4LXNvdC5jbm7SAQA?oc=5,[]
UFC Fight Night 219 predictions: Who's picking Jessica Andrade on short notice over Erin Blanchfield?,"UFC Fight Night 219 takes place Saturday at the UFC Apex in Las Vegas.
In the main event, former women’s strawweight champion Jessica Andrade (24-9 MMA, 15-7 UFC) takes on Erin Blanchfield (10-1 MMA, 4-0 UFC) at flyweight.
In the co-feature, Zac Pauga (6-1 MMA, 0-1 UFC) takes on Jordan Wright (12-4 MMA, 2-4 UFC) at light heavyweight.
Also on the main card, Josh Parisian (15-5 MMA, 2-2 UFC) meets Jamal Pogues (9-3 MMA, 0-0 UFC) at heavyweight.
And to open the main card, Alex Hernandez (13-6 MMA, 5-5 UFC) takes on UFC record holder Jim Miller (35-16 MMA, 24-15 UFC) at lightweight.",https://news.google.com/rss/articles/CBMicGh0dHBzOi8vbW1hanVua2llLnVzYXRvZGF5LmNvbS8yMDIzLzAyL3VmYy1maWdodC1uaWdodC0yMTktcHJlZGljdGlvbnMtcGlja3MtamVzc2ljYS1hbmRyYWRlLXZzLWVyaW4tYmxhbmNoZmllbGTSAQA?oc=5,"['Matt Erickson', 'Matthew Wells', 'Ken Hathaway', 'February', 'Pm Et']"
