title,summary,link,author
Woman pleads guilty in Detroit-area election threats case,"DETROIT (AP) — A New Hampshire woman pleaded guilty in federal court Thursday to texting threats to a Detroit-area election official after a November 2020 meeting to certify local results in the presidential race.
Katelyn Jones, 25, formerly of Olivet, Michigan, and now living in Epping New Hampshire, faces up to 10 years in federal prison.
Jones targeted Monica Palmer, the Republican chairwoman of the Wayne County Board of Canvassers, and her family, investigators said.
Jones sent photos of a dead body and threatened Palmer on Nov. 18, the FBI said.
They subsequently certified the totals in favor of Joe Biden after people watching the public meeting on video conference criticized them during a comment period.",https://news.google.com/rss/articles/CBMie2h0dHBzOi8vYXBuZXdzLmNvbS9hcnRpY2xlL2ZlZGVyYWwtZ3VpbHR5LXBsZWEtZWxlY3Rpb24tdGhyZWF0LTIwMjAtbWljaGlnYW4tbmV3LWhhbXBzaGlyZS1jNzYxMjdkZGFhNzRkNjE1OGEyMjRkYjgwMTAyMmVlMdIBAA?oc=5,[]
Twitter seeks to sublease NYC office space as Elon Musk cuts costs,"Inc. is seeking to sublease office space as the technology company looks to curb costs.
A spokesperson for Pacific Investment Management Co.’s Columbia Property Trust, the owner of the building, declined to comment.
The company has slashed jobs and been accused of missing rent payments on offices in San Francisco and London.
Subleasing the space could help Twitter reduce costs, given most property contracts require tenants to pay rent for the life of a lease even if the space isn’t occupied.
The 17th Street buildings were among a handful of properties tied up in a recent default by Pimco’s Columbia Property Trust.",https://news.google.com/rss/articles/CBMijgFodHRwczovL3d3dy5idXNpbmVzcy1zdGFuZGFyZC5jb20vYXJ0aWNsZS9pbnRlcm5hdGlvbmFsL3R3aXR0ZXItc2Vla3MtdG8tc3VibGVhc2UtbnljLW9mZmljZS1zcGFjZS1hcy1lbG9uLW11c2stY3V0cy1jb3N0cy0xMjMwMzAxMDAxMTRfMS5odG1s0gEA?oc=5,['Natalie Wong']
Ukraine official: Forces may pull out of key city of Bakhmut – KION546,"Kremlin forces have waged a bloody, monthslong offensive to take Bakhmut, a city of salt and gypsum mines in eastern Ukraine that has become a ghost town.
Bakhmut lies in Donetsk province, one of four provinces Russia illegally annexed last fall.
To take the remaining half of that province, Russian forces must go through Bakhmut, the only approach to bigger Ukrainian-held cities since Ukrainian troops took back Izium in Kharkiv province in September.
Rodnyansky noted that Russia was using the Wagner Group’s best troops to try to encircle the city.
“The Ukrainian army is deploying additional troops and is doing what it can to retain control of the city,” Prigozhin said.",https://news.google.com/rss/articles/CBMiXmh0dHBzOi8va2lvbjU0Ni5jb20vbmV3cy8yMDIzLzAzLzAxL3VrcmFpbmUtb2ZmaWNpYWwtc2F5cy1taWxpdGFyeS1tYXktcHVsbC1iYWNrLWZyb20tYmFraG11dC_SAQA?oc=5,['Associated Press']
NFL coach Brian Flores' discrimination case going to court,"The league had tried to move the Flores claims to arbitration, citing contracts that coaches had signed.
Flores sued the league and three teams a year ago, saying the league was “rife with racism,” particularly in its hiring and promotion of Black coaches.
“We are pleased that Coach Flores’ class claims of systematic discrimination against the NFL and several teams will proceed in court and ultimately before a jury of his peers,” attorney Douglas Wigdor said in an email.
In her opinion, Caproni said the case had shined “an unflattering spotlight on the employment practices of National Football League” teams.
“Although the clear majority of professional football players are Black, only a tiny percentage of coaches are Black,” she wrote.",https://news.google.com/rss/articles/CBMiaGh0dHBzOi8vd3d3Lm15c2FuYW50b25pby5jb20vc3BvcnRzL2FydGljbGUvanVkZ2UtbmZsLWNvYWNoLWNhbi1wcmVzcy1kaXNjcmltaW5hdGlvbi1jbGFpbXMtMTc4MTM3MzEucGhw0gEA?oc=5,"['Larry Neumeister', 'Associated Press']"
Brazil Legend Ronaldo Nazario Names His All Time Best XI As Lionel Messi Makes Cut,"Ronaldo Nazario has revealed his all-time best XI featuring legendary football starsThe ex-Brazil international overlooked Cristiano Ronaldo and included Lionel MessiMessi was recently crowned the best men's player of 2022 at FIFA's The Best AwardsBrazil football icon, Ronaldo Nazario has revealed his all-time best XI.
Messi's inclusion in Ronaldo's team came after the Argentine was named the FIFA Men's Best Player 2022 on Monday night in Paris.
Ronaldo names all-time best XIWhile Messi being named in Ronaldo's all-time best XI is no surprise, it is perhaps surprising that the Brazilian also chose himself for the team.
Ronaldo's XI in full: Buffon, Cafu, Beckenbauer, Maldini, Carlos, Zico, Diego Maradona, Messi, Ronaldo Nazario, Pele, Ronaldinho.
Ronaldinho makes return to footballSports Brief previously reported Brazilian football legend, Ronaldinho making a stunning return to football.",https://news.google.com/rss/articles/CBMiZGh0dHBzOi8vc3BvcnRzYnJpZWYuY29tL2Zvb3RiYWxsLzM1NTk0LWJyYXppbC1sZWdlbmQtcm9uYWxkby1uYXphcmlvLW5hbWVzLXRpbWUteGktbGlvbmVsLW1lc3NpLWN1dC_SAQA?oc=5,['Fred Kennedy']
Brisk daily walk could prevent one in 10 early deaths – study,"PARIS: One in 10 early deaths could be prevented if everyone engaged in a small amount of daily exercise such as a brisk 11-minute walk, a large study said on Wednesday.
Physical activity is known to reduce the risk of heart disease, cancer and other leading causes of death, but exactly how much is needed to have an impact has been unclear.
For a person who engages in little to no physical activity, 11 minutes a day led to a 23-percent lower risk of early death.
Soren Brage, an expert on the epidemiology of physical activity at Britain's Cambridge University and a co-author of the study, told Agence France-Presse that it was ""exceptionally good news.""
Cardiovascular diseases such as heart attack and stroke killed 17.9 million people globally in 2019, while cancer accounted for nearly 10 million deaths the following year, according to the World Health Organization.",https://news.google.com/rss/articles/CBMib2h0dHBzOi8vd3d3Lm1hbmlsYXRpbWVzLm5ldC8yMDIzLzAzLzAxL25ld3MvYnJpc2stZGFpbHktd2Fsay1jb3VsZC1wcmV2ZW50LW9uZS1pbi0xMC1lYXJseS1kZWF0aHMtc3R1ZHkvMTg4MDgyOdIBAA?oc=5,['Agence France-Presse']
World's Leading Award for Animal Conservation Names Six Finalists,"A nine-person committee with ties to the scientific and conservation communities, the Indianapolis Zoological society and local community selected the six Finalists for the 2023 Indianapolis Prize.
The Winner of the 2023 Indianapolis Prize will be announced on May 16 and will receive their award on Sept. 30 at the Indianapolis Prize Gala presented by Cummins Inc.
""The vital work of this year's Finalists to save animal species is inspiring,"" said 2021 and 2023 Indianapolis Prize Gala co-host Danni Washington.
Since 2006, the Indianapolis Prize has administered more than $5.6 million in cash awards.
The Indianapolis Prize is administered by the Indianapolis Zoological Society.",https://news.google.com/rss/articles/CBMiVmh0dHBzOi8vZmluYW5jZS55YWhvby5jb20vbmV3cy93b3JsZHMtbGVhZGluZy1hd2FyZC1hbmltYWwtY29uc2VydmF0aW9uLTExMDIwMDIyNC5odG1s0gEA?oc=5,[]
Football rumours: Newcastle eye move for Arsenal defender Kieran Tierney,"Kieran Tierney could be on his way to Newcastle (Steven Paston/PA) — © Steven PastonNewcastle are considering a summer move for Arsenal defender Kieran Tierney, according to the Mirror.
Social media round-upWe need your consent to load this Social Media content.
We use a number of different Social Media outlets to manage extra content that can set cookies on your device and collect data about your activity.
Please review your details and accept them to load the contentWe need your consent to load this Social Media content.
Sergej Milinkovic-Savic: Arsenal, Newcastle and West Ham have all made offers of around £25million for the Lazio midfielder.",https://news.google.com/rss/articles/CBMilwFodHRwczovL3d3dy5iZWxmYXN0dGVsZWdyYXBoLmNvLnVrL3Nwb3J0L2Zvb3RiYWxsL3ByZW1pZXItbGVhZ3VlL2Zvb3RiYWxsLXJ1bW91cnMtbmV3Y2FzdGxlLWV5ZS1tb3ZlLWZvci1hcnNlbmFsLWRlZmVuZGVyLWtpZXJhbi10aWVybmV5Lzg3NjAwNjM4MS5odG1s0gEA?oc=5,['Pa Sport Staff']
‘Dukes Of Hazzard’ Star John Schneider Reflects On Death Of Wife Alicia At 53,"John Schneider has opened up about his emotions after the death of his wife Alicia.
And the Dukes of Hazzard star, 62, shared that his wife’s passing at age 53 made him reflect on how much he loved her.
Learn what the the Dukes of Hazzard star shared about his wife.
John Schneider – Mourns Death Of Wife Alicia, 53Dukes of Hazzard star John Schneider, 62, mourns the passing of his wife, Alicia Allain.
“Please respect our privacy during this time of grief,” requested the Dukes of Hazzard star.",https://news.google.com/rss/articles/CBMie2h0dHBzOi8vY2VsZWJyYXRpbmd0aGVzb2Fwcy5jb20vY2VsZWJyaXR5LW5ld3MvZHVrZXMtb2YtaGF6emFyZC1zdGFyLWpvaG4tc2NobmVpZGVyLXJlZmxlY3RzLW9uLWRlYXRoLW9mLXdpZmUtYWxpY2lhLWF0LTUzL9IBAA?oc=5,['Joanne Eglash']
Kootenay pop singer Shawn Hook says he has throat cancer,"Shawn Hook is seen here performing in 2018.
File photoPop singer and South Slocan native Shawn Hook has announced he has throat cancer.
Hook, who was twice nominated for Juno Awards in 2013 and 2016, said in a Facebook post Tuesday that he was diagnosed with throat cancer on Jan. 31.
“As you can imagine, this was life changing news and it hit me like a ton of bricks,” wrote Hook.
“This is just the start of my battle and I’m taking it one day at a time.",https://news.google.com/rss/articles/CBMiX2h0dHBzOi8vd3d3LmNhbGVkb25pYWNvdXJpZXIuY29tL25ld3Mva29vdGVuYXktcG9wLXNpbmdlci1zaGF3bi1ob29rLXNheXMtaGUtaGFzLXRocm9hdC1jYW5jZXIv0gEA?oc=5,['Nelson Star Staff']
The truth behind the 'He Gets Us' ads airing during the Super Bowl,"CNN —In between star-studded advertisements and a whole lot of football, this year’s Super Bowl watchers are being taken to church.
“He Gets Us,” a campaign to promote Jesus and Christianity, is running two ads during the game as part of a staggering $100 million media investment.
Sue Ogrocki/APGreen discussed his involvement in the campaign, and the Super Bowl ad spots, during a November 2022 interview with conservative talk show host Glenn Beck.
I think we have to let the public know and create a movement.”“He Gets Us” does not list donors on its website.
CNN asked Vanderground, the representative for He Gets Us, if the campaign supports and affirms LGBTQ Christians.",https://news.google.com/rss/articles/CBMiUmh0dHBzOi8vd3d3LmNubi5jb20vMjAyMy8wMi8xMS91cy9oZS1nZXRzLXVzLXN1cGVyLWJvd2wtY29tbWVyY2lhbHMtY2VjL2luZGV4Lmh0bWzSAQA?oc=5,['Aj Willingham']
Critics reject changes to Roald Dahl books as censorship,"A review of new editions of Dahl’s books now available in bookstores shows that some passages relating to weight, mental health, gender and race were altered.
The changes made by Puffin Books, a division of Penguin Random House, first were reported by Britain’s Daily Telegraph newspaper.
“Roald Dahl was no angel but this is absurd censorship,’’ Rushdie wrote on Twitter.
It said the analysis started in 2020, before Netflix bought the Roald Dahl Story Company and embarked on plans to produce a new generation of films based on the author's books.
PEN America, a community of some 7,500 writers that advocates for freedom of expression, said it was “alarmed” by reports of the changes to Dahl’s books.",https://news.google.com/rss/articles/CBMiZmh0dHBzOi8vd3d3LmNvYXN0cmVwb3J0ZXIubmV0L3RoZS1taXgvY3JpdGljcy1yZWplY3QtY2hhbmdlcy10by1yb2FsZC1kYWhsLWJvb2tzLWFzLWNlbnNvcnNoaXAtNjU4MDc0ONIBAA?oc=5,"['Danica Kirka', 'The Associated Press']"
Lehigh County OKs $900K in relief funds for nonprofits,"Allentown, PA (18103)TodaySome morning sunshine, then becoming cloudy with a wintry mix or some rain developing later in the day.
Turns breezy by evening.
A coating to an inch possible before the change, mostly in the Poconos. .TonightPeriods of rain, heavy at times the first half of the night.
Any wintry mix early on in the Poconos changes to rain.
Brisk easterly winds gust over 30mph in spots.",https://news.google.com/rss/articles/CBMikwFodHRwczovL3d3dy53Zm16LmNvbS9uZXdzL2FyZWEvbGVoaWdodmFsbGV5L2xlaGlnaC1jb3VudHktb2tzLTkwMGstaW4tcmVsaWVmLWZ1bmRzLWZvci1ub25wcm9maXRzL2FydGljbGVfZjQ0MWMzOTYtYjMxZC0xMWVkLWIwODAtODM3MGNmMDc1MDVhLmh0bWzSAQA?oc=5,"['Steve Althouse', 'Lehigh And Northampton Transportation Authority']"
Supreme Court dismisses PIL seeking ban of BBC in India; calls it misconceived,"Supreme CourtThe Supreme Court on February 10, dismissed a plea filed by Hindu Sena seeking a ban on the British Broadcasting Corporation (BBC) for airing the documentary on PM Modi and anti-India reporting.
A bench of the apex court led by Justice Sanjiv Khanna observed that the plea was entirely misconceived and the court cannot impose a complete censorship.
It further alleged that BBC documentary on PM Narendra Modi is result of deep conspiracy against global rise of India and its PM.
The bench had also asked the government to submit files pertaining to the ban in the court.
On January 21, the Centre issued directions for blocking multiple YouTube videos and Twitter posts sharing links to the controversial BBC documentary ""India: The Modi Question"", according to sources.",https://news.google.com/rss/articles/CBMiigFodHRwczovL3d3dy5tb25leWNvbnRyb2wuY29tL25ld3MvdHJlbmRzL2xlZ2FsL3N1cHJlbWUtY291cnQtZGlzbWlzc2VzLXBpbC1zZWVraW5nLWJhbi1vZi1iYmMtaW4taW5kaWEtY2FsbHMtaXQtbWlzY29uY2VpdmVkLTEwMDUwNDMxLmh0bWzSAQA?oc=5,[]
Exercise Update,"Exercise UpdateBack in November, my dad and I started working out together at Planet Fitness.
After about a month of going to the gym, I got COVID for the third time.
I feel like if I talk about my eating habits, it’s just a window into my home of mental illnesses.
Do I not exercise because I’m depressed?
I’m going to wear shorts and dresses and swimsuits and I’m going to enjoy the sun and the water and all the food I want.",https://news.google.com/rss/articles/CBMiN2h0dHBzOi8vd2hhdGV2ZXIuc2NhbHppLmNvbS8yMDIzLzAyLzIyL2V4ZXJjaXNlLXVwZGF0ZS_SAQA?oc=5,['Athena Scalzi']
2 brothers charged in arena slaying during basketball game,"TRENTON, N.J. (AP) — Two brothers have been charged in a stabbing death at a New Jersey arena during a high school basketball tournament game last week, authorities said Tuesday.
Authorities found Glanton stabbed after a fight that broke out following a game Thursday night at the CURE Insurance Arena in Trenton, according to Mercer County prosecutors.
Kareen Finney held Glanton while his younger brother repeatedly stabbed him, investigators allege, citing video and witness interviews.
Investigators also discovered that the brothers had an ongoing dispute with the victim over a female, prosecutors said.
A phone number listed for Kareem Finney rang unanswered and then disconnected, and a listed phone number for Kahli Finney couldn’t be found Tuesday night.",https://news.google.com/rss/articles/CBMiYWh0dHBzOi8vd3d3LmJsYWNraGlsbHNmb3guY29tLzIwMjMvMDIvMjIvMi1icm90aGVycy1jaGFyZ2VkLWFyZW5hLXNsYXlpbmctZHVyaW5nLWJhc2tldGJhbGwtZ2FtZS_SAQA?oc=5,[]
Japan Manufacturers Gloomy as Global Slowdown Hurts - Reuters Tankan,"By Tetsushi KajimotoTOKYO (Reuters) - Big manufacturers in Japan remained gloomy in February and the service-sector mood slid for a second straight month, a Reuters' poll showed, a sign that the global slowdown is holding back the country's recovery from COVID-induced economic doldrums.
The monthly Reuters Tankan, which closely tracks the Bank of Japan's (BOJ) key tankan quarterly survey, found the sentiment index for big manufacturers stood at -5 in February, little changed from the prior month's -6.
The survey asks respondents whether the business situation is good, not so good or bad.
On top of that, wages are rising, all of which squeezes the business environment,"" a manager of a metal processing firm wrote in the survey.
Japan's economy averted recession in the fourth quarter but rebounded much less than expected as business investment slumped.",https://news.google.com/rss/articles/CBMifmh0dHBzOi8vbW9uZXkudXNuZXdzLmNvbS9pbnZlc3RpbmcvbmV3cy9hcnRpY2xlcy8yMDIzLTAyLTIxL2phcGFuLW1hbnVmYWN0dXJlcnMtZ2xvb215LWFzLWdsb2JhbC1zbG93ZG93bi1odXJ0cy1yZXV0ZXJzLXRhbmthbtIBAA?oc=5,"['Feb.', 'At P.M.']"
How to open all Slytherin Locks in Hogwarts Legacy,"This particular mystery is about the Slytherin Locks which is part of a quest.
Here is how you can open Slytherin Locks in Hogwarts Legacy.
How to solve Slytherin Locks in Hogwarts LegacyUnlocking the Slytherin Locks is part of In The Shadow of the Study quest in which you help Ominis and Sebastian get inside Salazar Slytherin's Scriptorium.
Part of the quest requires you to solve Slytherin Lock puzzles to gain access to another room.
This is when you come across the Slytherin Locks in Hogwarts Legacy.",https://news.google.com/rss/articles/CBMiWWh0dHBzOi8vcHJvZ2FtZWd1aWRlcy5jb20vaG9nd2FydHMtbGVnYWN5L2hvdy10by1vcGVuLXNseXRoZXJpbi1sb2Nrcy1pbi1ob2d3YXJ0cy1sZWdhY3kv0gEA?oc=5,['Shreya Paul']
Actress Raquel Welch has Died,"Actress Raquel Welch, known for her roles in “Fantastic Voyage” and “One Million Years B.C.”, has died, reported CNN.
Welch is survived by two children, son Damon Welch and her daughter Tahnee Welch, according to her manager’s statement to CNN.
Witherspoon shared on Twitter, “So sad to hear about Raquel Welch’s passing.
Sending love to her family and her many fans.”The Muppets shared, “We’ll never forget our remarkable friend Raquel Welch, one of our favorite guests on The Muppet Show.
From dancing with a giant spider, to inspiring ” href=”https://twitter.com/FozzieBear”>@FozzieBear, and duetting with @MissPiggy, Raquel could do it all!”",https://news.google.com/rss/articles/CBMiPWh0dHBzOi8vd2lsc29uY291bnR5c291cmNlLmNvbS9hY3RyZXNzLXJhcXVlbC13ZWxjaC1oYXMtZGllZC_SAQA?oc=5,"['Donna Vissman', 'Donna Is One Of Those Former Corporate Types', 'Xerox', 'Who Wanted To Try Something New. She Went Marketing To Blogger', 'Now Lifestyle Reporter', 'Is Always On The Lookout For What S Trending In Restaurants', 'New Stores', 'Charity Events', 'Entertainment. To Keep Up The Pace', 'Donna Is Usually Found Drinking At Least One Cold Brew Coffee A Day Or On A Busy Day']"
Mega Millions: A single winning ticket for Friday's $1.35 billion jackpot drawing was sold in Maine,"CNN —One ticket sold in Maine beat the eerie odds of Friday the 13th and its buyer is set to claim the Mega Millions jackpot of about $1.35 billion, the lottery said.
Winning ticket sold at Hometown Gas & Grill in Lebanon Maine,” the Maine Lottery said in a Facebook post early Saturday.
“It’s the fourth billion-dollar jackpot in Mega Millions history.”Friday’s jackpot was Mega Millions’ second-largest ever, surpassed only by the lottery’s record of $1.537 billion won in South Carolina in 2018, the lottery said.
Other big winners from Friday’s drawing include 14 tickets that snagged $1 million prizes, according to Mega Millions.
Mega Millions is played in 45 states, along with the District of Columbia and the US Virgin Islands.",https://news.google.com/rss/articles/CBMiUmh0dHBzOi8vd3d3LmNubi5jb20vMjAyMy8wMS8xNC91cy9tZWdhLW1pbGxpb25zLWphY2twb3Qtd2lubmVyLXNhdHVyZGF5L2luZGV4Lmh0bWzSAQA?oc=5,"['Tina Burnside Aya Elamroussi', 'Tina Burnside', 'Aya Elamroussi']"
Japan Manufacturers Gloomy as Global Slowdown Hurts - Reuters Tankan,"By Tetsushi KajimotoTOKYO (Reuters) - Big manufacturers in Japan remained gloomy in February and the service-sector mood slid for a second straight month, a Reuters' poll showed, a sign that the global slowdown is holding back the country's recovery from COVID-induced economic doldrums.
The monthly Reuters Tankan, which closely tracks the Bank of Japan's (BOJ) key tankan quarterly survey, found the sentiment index for big manufacturers stood at -5 in February, little changed from the prior month's -6.
The survey asks respondents whether the business situation is good, not so good or bad.
On top of that, wages are rising, all of which squeezes the business environment,"" a manager of a metal processing firm wrote in the survey.
Japan's economy averted recession in the fourth quarter but rebounded much less than expected as business investment slumped.",https://news.google.com/rss/articles/CBMifmh0dHBzOi8vbW9uZXkudXNuZXdzLmNvbS9pbnZlc3RpbmcvbmV3cy9hcnRpY2xlcy8yMDIzLTAyLTIxL2phcGFuLW1hbnVmYWN0dXJlcnMtZ2xvb215LWFzLWdsb2JhbC1zbG93ZG93bi1odXJ0cy1yZXV0ZXJzLXRhbmthbtIBAA?oc=5,"['Feb.', 'At P.M.']"
"Code deciphered in jail letters written by Mary, Queen of Scots","Mary is thought to have hidden codes in her correspondence to others (Picture: PA)Coded letters written by Mary, Queen of Scots before she was put to death have been discovered in a French archive more than 430 years after she wrote them.
Researchers only realised the imprisoned queen was the author when they cracked the famously sophisticated cipher system she used to communicate with her supporters.
Although Mary’s extensive correspondence is held in various archives, Dr Lasly said there was evidence of gaps in those collections.
‘The letters we have deciphered are most likely part of this lost secret correspondence,’ he added.
‘Together, the letters constitute a voluminous body of new primary material on Mary Stuart – about 50,000 words in total.’The decipherment work is published in the journal Cryptologia.",https://news.google.com/rss/articles/CBMiZ2h0dHBzOi8vbWV0cm8uY28udWsvMjAyMy8wMi8wOC9jb2RlLWRlY2lwaGVyZWQtaW4tamFpbC1sZXR0ZXJzLXdyaXR0ZW4tYnktbWFyeS1xdWVlbi1vZi1zY290cy0xODI0MjQ4Ni_SAQA?oc=5,['Stephen Beech']
How to open all Slytherin Locks in Hogwarts Legacy,"This particular mystery is about the Slytherin Locks which is part of a quest.
Here is how you can open Slytherin Locks in Hogwarts Legacy.
How to solve Slytherin Locks in Hogwarts LegacyUnlocking the Slytherin Locks is part of In The Shadow of the Study quest in which you help Ominis and Sebastian get inside Salazar Slytherin's Scriptorium.
Part of the quest requires you to solve Slytherin Lock puzzles to gain access to another room.
This is when you come across the Slytherin Locks in Hogwarts Legacy.",https://news.google.com/rss/articles/CBMiWWh0dHBzOi8vcHJvZ2FtZWd1aWRlcy5jb20vaG9nd2FydHMtbGVnYWN5L2hvdy10by1vcGVuLXNseXRoZXJpbi1sb2Nrcy1pbi1ob2d3YXJ0cy1sZWdhY3kv0gEA?oc=5,['Shreya Paul']
Mega Millions: A single winning ticket for Friday's $1.35 billion jackpot drawing was sold in Maine,"CNN —One ticket sold in Maine beat the eerie odds of Friday the 13th and its buyer is set to claim the Mega Millions jackpot of about $1.35 billion, the lottery said.
Winning ticket sold at Hometown Gas & Grill in Lebanon Maine,” the Maine Lottery said in a Facebook post early Saturday.
“It’s the fourth billion-dollar jackpot in Mega Millions history.”Friday’s jackpot was Mega Millions’ second-largest ever, surpassed only by the lottery’s record of $1.537 billion won in South Carolina in 2018, the lottery said.
Other big winners from Friday’s drawing include 14 tickets that snagged $1 million prizes, according to Mega Millions.
Mega Millions is played in 45 states, along with the District of Columbia and the US Virgin Islands.",https://news.google.com/rss/articles/CBMiUmh0dHBzOi8vd3d3LmNubi5jb20vMjAyMy8wMS8xNC91cy9tZWdhLW1pbGxpb25zLWphY2twb3Qtd2lubmVyLXNhdHVyZGF5L2luZGV4Lmh0bWzSAQA?oc=5,"['Tina Burnside Aya Elamroussi', 'Tina Burnside', 'Aya Elamroussi']"
Haley faces 'high-wire act' in 2024 bid against Trump,"New Castle, PA (16103)TodayShowers in the morning, then becoming windy with a steady rain in the afternoon.
Winds ESE at 20 to 30 mph.
Chance of rain 100%.
SE winds shifting to SW at 25 to 35 mph.
Chance of precip 100%.",https://news.google.com/rss/articles/CBMikAFodHRwczovL3d3dy5uY25ld3NvbmxpbmUuY29tL25ld3MvbmF0aW9uYWwvaGFsZXktZmFjZXMtaGlnaC13aXJlLWFjdC1pbi0yMDI0LWJpZC1hZ2FpbnN0LXRydW1wL2FydGljbGVfNmI5MWM4ZDItZTVmMi01MWQ5LWIwYzUtMWRhZWYwYTI1MDMzLmh0bWzSAQA?oc=5,"['Meg Kinnard', 'Steve Peoples - Associated Press', 'John Locher - Staff', 'Seth Wenig - Staff', 'Carolyn Kaster - Staff', 'Evan Vucci - Staff', 'Mary Altaffer - Staff']"
How to Heal in Hogwarts Legacy,"Hogwarts Legacy is finally here, with millions of gamers around the world exploring the Wizarding World and making their way through the hefty quest list.
Along the way, you’ll meet beasts and other nasties to battle with, so will need to use your spells wisely.
Thankfully, there are a few simple way of doing this in Hogwarts, which we go into below.
How to heal in Hogwarts LegacyTo heal you use what’s called a Wiggenweld Potion, a healing potion that lets you recover from injuries.
The Wiggenweld Potion can be brewed at Potion Stations (image taken by Videogamer.com)To create the Wiggenweld Potion, you’ll need the following ingredients:1 x Horklump Juice1 x Dittany LeavesPotions take 15 seconds to brew.",https://news.google.com/rss/articles/CBMiPmh0dHBzOi8vd3d3LnZpZGVvZ2FtZXIuY29tL2d1aWRlcy9ob2d3YXJ0cy1sZWdhY3ktaG93LXRvLWhlYWwv0gEA?oc=5,['Talal Musa']
